{
  "authority_boundary": "EVIDENCE_LANDSCAPE_ONLY",
  "budget_history": [
    {
      "consumer_authorized_units": 1,
      "consumer_used_units": 1,
      "source_budget_id": "BE-PACKAGE-C-001",
      "source_budget_sha256": "77da756a15ed613c8477e46e0b966341705911e277d774d807df92f15658d635"
    }
  ],
  "candidate_pointer_lineage": [
    {
      "artifact_type": "CandidatePointer",
      "candidate_pointer_id": "CP-PACKAGE-C-001",
      "route_id": "ER-901"
    }
  ],
  "collision_ids": [],
  "contested_scoped_claims": [],
  "coverage_summary": {
    "evidence_inaccessible": 0,
    "propositions_grounded": 1,
    "propositions_unresolved": 0,
    "requirements_covered": [
      "MR-CQC-65f83b6062a3"
    ],
    "requirements_partially_covered": [],
    "requirements_uncovered": [],
    "routes_executed": [
      "ER-901"
    ],
    "routes_exhausted": [],
    "routes_underexplored": []
  },
  "created_at": "2026-09-06T00:00:00Z",
  "evidence_span_ids": [
    "ES-37d39b7f4b82"
  ],
  "new_evidence_obligations": [],
  "package_id": "ELP-901",
  "proposition_evidence_ids": [
    "PE-568fca089922"
  ],
  "provenance_manifest": {
    "cqc_mafs_integration": {
      "consumer_binding_id": "CQCB-fe437951b9d3ecba",
      "consumer_binding_sha256": "cdf2a3bba6273008941a74573cb047744531d1c13453758d13e1064a95025092",
      "m5_accepted_sha": "ecfa39e9fdeced45848c643544477e408e872d60",
      "package_c_adapter_version": "mafs-skill-1.1-package-c.v1",
      "source_budget_ids": [
        "BE-PACKAGE-C-001"
      ],
      "source_cqc_freeze_sha": "c5c00a19f9812058050ba16ad61b717a1c1f1ca2",
      "source_cqs_ids": [
        "CQS-PACKAGE-C-001"
      ],
      "source_integration_binding_id": "BIND-PACKAGE-C-001",
      "source_integration_binding_sha256": "953fbba357c06ebf0d9c1c13f104885c2255d081a6975ce5bc3f4e56e6960e82",
      "source_srp_ids": [
        "SRP-PACKAGE-C-001"
      ]
    },
    "research_state_id": "RS-901",
    "typed_evidence_layers_preserved": [
      "CandidatePointer",
      "SourceDocument",
      "EvidenceSpan",
      "PropositionEvidence"
    ]
  },
  "requirement_ids": [
    "MR-CQC-65f83b6062a3"
  ],
  "route_history": [
    {
      "execution_state": "COVERED",
      "history_kind": "ORIGINAL",
      "origin_requirement_id": "MR-CQC-65f83b6062a3",
      "parent_route_ids": [],
      "route_id": "ER-901"
    }
  ],
  "schema_version": "3.0-post-p1p5-b",
  "search_portfolio_history": [
    {
      "active_routes": [
        "ER-901"
      ],
      "budget_authorization": 1,
      "budget_used": 1,
      "coverage_obligations": [
        "MR-CQC-65f83b6062a3"
      ],
      "created_at": "2026-09-06T00:00:00Z",
      "portfolio_id": "SP-901",
      "schema_version": "3.0-post-p1p5-a",
      "uncovered_obligations": []
    }
  ],
  "selection_lineage": [
    {
      "candidate_pointer_ids": [
        "CP-PACKAGE-C-001"
      ],
      "provenance": {
        "decision_record": "demo_positive/selection_artifact.json"
      },
      "rendering_path": "package_c_hermetic_open_discovery",
      "schema_version": "3.0-post-p1p5-a",
      "search_order_id": "SO-R901-1",
      "selected_candidate_pointer_ids": [
        "CP-PACKAGE-C-001"
      ],
      "selection_authority": "package-c-hermetic-external-selector",
      "selection_id": "SEL-901",
      "selection_reason": "The candidate directly addresses the admitted route intent.",
      "timestamp": "2026-09-06T00:00:00Z"
    }
  ],
  "source_document_ids": [
    "SD-3d624b96f0aa"
  ],
  "source_research_state_id": "RS-901",
  "supported_scoped_claims": [],
  "unresolved_obligations": []
}
